"Institution.Source","Catalog.Number","Number.of.specimens","Family","Scientific.name","Locality","County","Latitude","Longitude","State","Date.Collected","Field.Locality.number","Collectors"
"NCDWR","","203","Cottidae","Cottus bairdii","Bald Cr, US 19W","Yancey",35.9158333333333,-82.3913888888889,"NC","37938","2003-75",""
"NCDWR","","349","Cottidae","Cottus bairdii","Bald Mountain Cr, SR 1408","Yancey",35.9838888888889,-82.4091666666667,"NC","35724","97-90",""
"NCDWR","","321","Cottidae","Cottus bairdii","Big Cr, SR 1444","Yancey",36.0154299,-82.3515462,"NC","39254","2007-92",""
"NCDWR","","195","Cottidae","Cottus bairdii","Big Cr, SR 1444","Yancey",36.0154299,-82.3515462,"NC","41073","2012-59",""
"NCDWR","","1","Cottidae","Cottus bairdii","Cane R, SR 1343 & SR 1417","Yancey",36.0255,-82.3279,"NC","40309","2010-23",""
"NCDWR","","3","Cottidae","Cottus bairdii","Cane R, US 19W & SR 1417","Yancey",36.01583,-82.351282,"NC","40309","2010-24",""
"NCDWR","","42","Cottidae","Cottus bairdii","Possumtrot Cr, SR 1128","Yancey",35.9125,-82.4013888888889,"NC","37938","2003-76",""
"NCDWR","","297","Cottidae","Cottus bairdii","Price Cr, SR 1126/1136","Yancey",35.9051533,-82.3821605,"NC","35724","97-89",""
"NCDWR","","185","Cottidae","Cottus bairdii","Price Cr, SR 1126/1136","Yancey",35.9051533,-82.3821605,"NC","37427","2002-77",""
"NCDWR","","75","Cottidae","Cottus bairdii","Price Cr, SR 1126/1136","Yancey",35.9051533,-82.3821605,"NC","41072","2012-56",""
"OSUM","59659","","Cottidae","Cottus bairdii","Pigeon River 300 yards below confluence of east and west forks @ RM 69.2 (ROT)","Haywood",35.481139,-82.882141,"NC","8/18/1980","","Freeman, G. M. Waters, et al."
"RCIC","","4","Cottidae","Cottus bairdii","North Toe River at Rt 1107 bridge off Rt 19 E ri mi 47.4","Avery",35.9637861111111,-82.0302583333333,"NC","30860","WHH-294","Haxo, Briles, Kime"
"RCIC","","44","Cottidae","Cottus bairdii","Nottely River at RM 10.8, Kisselburg Farm, mouth Rapier Mill Creek","Cherokee",35.0152805555556,-84.13755,"NC","36593","REJ-1786","Jenkins, Matthews, Scott"
"RCIC","","24","Cottidae","Cottus bairdii","Nottely River at RM 7.3-7.5, along Die Bend Rd, 0.9 air mi NE Ranger","Cherokee",35.040345,-84.115104,"NC","36594","REJ-1787","Jenkins, Butler, Matthews, Scott"
"RCIC","","6","Cottidae","Cottus bairdii","Peachtree Creek at Rt 64 bridge, 3.6 air mi ESE Murphy","Cherokee",35.0779333333333,-83.974675,"NC","34839","REJ-1456","Jenkins, class"
"RCIC","","5","Cottidae","Cottus bairdii","Valley River RM 19.3-20.1, Andrews","Cherokee",35.2047944444444,-83.8239888888889,"NC","36453","REJ-1769","Jenkins, M.D. Cantwell. Yow"
"RCIC","","1","Cottidae","Cottus bairdii","Brasstown Creek 0.7 air mi SSW Warne","Clay",34.9931472222222,-83.9057083333333,"NC","34839","REJ-1459","Jenkins, class"
"RCIC","","44","Cottidae","Cottus bairdii","Hiwassee River RM 112.9-113.1, 2.65 airmi NW center Hayesville","Clay",35.076506,-83.847159,"NC","36588","REJ-1785","Jenkins, Austin, Matthews,  Scott, TVA"
"RCIC","","13","Cottidae","Cottus bairdii","Mull Creek at Rt 1737 bridge above mouth Beech Flat","Jackson",35.3412111111111,-83.02975,"NC","30820","","J. West,"
"RCIC","","3","Cottidae","Cottus bairdii","Oconaluftee River at Ela on Rt 19 just S jct Rts 19-19A","Jackson",35.450249,-83.389196,"NC","24994","TZ-198","T. Zorach, L.P. Jones"
"RCIC","","3","Cottidae","Cottus bairdii","Big Rock Creek below bridge on Rt 226, 4.2 air mi W Bakersville, tributary of North Toe River","Mitchell",36.0396305555556,-82.2297611111111,"NC","30854","WHH-282","Haxo, Briles, Kime"
"RCIC","","2","Cottidae","Cottus bairdii","North Toe River off Altapass Rd highway 200 yards above its bridge, 1.8 airmi ESE Spruce Pine, near small island","Mitchell",35.905755,-82.044289,"NC","30854","WHH-283","Haxo, Briles, Kime"
"RCIC","","25","Cottidae","Cottus bairdii","Shut-in Creek, off Old Soco Road","Swain",35.468998,-83.21414,"NC","38146","","J. Boaze, Fish and Wildlife Association"
"ROM","23100","1","Cottidae","Cottus bairdii","Santeetlah Creek, Stn # 2","Graham",35.345379,-83.989852,"NC","21803","","Humphries, B."
"TU","105150","1","Cottidae","Cottus bairdii","South Fork of New River at County Road 1179, 6.5 air mi. SSE of West Jefferson.","Ashe",36.31278,-81.46555,"NC","9/22/1977","","Beckham & Beckham"
"TU","105047","1","Cottidae","Cottus bairdii","South Fork of New River at jct. NC Hwys. 16 & 88, about 5 mi.  E of Jefferson.","Ashe",36.39444,-81.40778,"NC","9/19/1977","","Beckham & Beckham"
"TU","29803","2","Cottidae","Cottus bairdii","North Fork of Swannanoa River 2.0 mi. N Grovestone.","Buncombe",35.63611,-82.35639,"NC","8/29/1962","","J.S. Ramsey"
"TU","193738","46","Cottidae","Cottus bairdii","Nottley River at Hwy 60 spur 2 mi. east of Culberson","Cherokee",35.0009,-84.14133,"NC","10/1/2001","","H.L. Bart Jr."
"TU","183131","1","Cottidae","Cottus bairdii","Oconaluftee River at US Hwy. 441; boundary of Great Smoky Mountains National Park.","Cherokee",35.46917,-83.3225,"NC","5/19/1977","","H.L. Bart, Jr."
"TU","25648","22","Cottidae","Cottus bairdii","Valley River & trib. 4.6 mi. SW Marble on Hwy. 19 & 129.","Cherokee",35.13194,-83.98473,"NC","6/3/1961","","J.S. Ramsey & K.G. Couture"
"TU","25669","3","Cottidae","Cottus bairdii","Valley River 5.9 mi. NE Andrews on Hwy. 19 & 129.","Cherokee",35.22972,-83.73805,"NC","6/3/1961","","J.S. Ramsey & K.G. Couture"
"TU","37524","7","Cottidae","Cottus bairdii","Valley River at Andrews Hwy. 19 & 129, upstream.","Cherokee",35.22417,-83.74472,"NC","4/26/1965","","R.D. Suttkus & Francis Rose"
"TU","190408","75","Cottidae","Cottus bairdii","Valley River at Country Hearth Rd. W. of Andrews Rt. 29/129","Cherokee",35.20583,-83.82777,"NC","4/14/1999","","Bart & Piller"
"TU","32792","20","Cottidae","Cottus bairdii","Valley River trib. to Hiwassee River on W side of Andrews, Hwy. 19 & 129.","Cherokee",35.22417,-83.74472,"NC","6/2/1964","","R.D. Suttkus & J.S. Ramsey"
"TU","29691","6","Cottidae","Cottus bairdii","Hiwassee River 1.2 mi. E Hayesville, Hwy. 64.","Clay",35.03472,-83.80889,"NC","8/12/1962","","J.S. Ramsey"
"TU","29702","14","Cottidae","Cottus bairdii","Shooting Creek, trib. to Chatuge Lake, 12.0 mi. E Hayesville, Hwy. 64.","Clay",35.02861,-83.65611,"NC","8/12/1962","","J.S. Ramsey"
"TU","29692","17","Cottidae","Cottus bairdii","Tusquitee Creek, trib. to Hiwassee River, 3.5 mi. N Hayesville.","Clay",35.07583,-83.78278,"NC","8/12/1962","","J.S. Ramsey"
"TU","191508","5","Cottidae","Cottus bairdii","Pigeon River at Pisgah Memorial Stadium in Canton","Haywood",35.52444,-82.84583,"NC","4/9/2000","",""
"TU","188873","6","Cottidae","Cottus bairdii","Pigeon River, upstream Pigsah Memorial Stadium, Canton.","Haywood",35.52555,-82.84805,"NC","4/25/1999","","H.L. Bart & K.R. Piller"
"TU","27041","3","Cottidae","Cottus bairdii","Hungry River, trib. to Green River, about 2.6 mi. due ESE Dana on gravel road.","Henderson",35.32139,-82.33195,"NC","8/28/1962","","J.S. Ramsey"
"TU","27033","22","Cottidae","Cottus bairdii","Jct. of Hungry & Little Hungry River, trib. to Green River, about 1.8 mi. ESE Dana.","Henderson",35.32139,-82.34417,"NC","8/28/1962","","J.S. Ramsey"
"TU","199650","2","Cottidae","Cottus bairdii","North Frok Mills River downstream of L. > Morre Rd Bridge Crossing ~ 2.4 mi W Mills River","Henderson",35.39334,-82.61667,"NC","5/3/2005","","M. F. Cashner and S. Woltmann"
"TU","29437","4","Cottidae","Cottus bairdii","Reedypatch Creek, trib. to Broad River, 0.5 mi. SW Bat Cave, Hwy. 64.","Henderson",35.44889,-82.29,"NC","7/5/1962","","W.S. Woolcott, J.S. Ramsey & H.H. Howell"
"TU","7045","2","Cottidae","Cottus bairdii","1 mi. E of Cherokee along Soco Creek.","Jackson",35.47028,-83.30945,"NC","8/4/1953","","E.A. Liner"
"TU","29563","4","Cottidae","Cottus bairdii","Caney Creek, trib. to Tuckasegee River, 3.6 mi. SE Cullowhee, Hwy. 107.","Jackson",35.29722,-83.14584,"NC","7/18/1962","","J.S. Ramsey & H.H. Howell"
"TU","29566","2","Cottidae","Cottus bairdii","Savannah Creek, trib. to Tuckasegee River, 0.7 mi. W Webster, Hwy. 116.","Jackson",35.3375,-83.23695,"NC","7/18/1962","","J.S. Ramsey & H.H. Howell"
"TU","29182","12","Cottidae","Cottus bairdii","Scott Creek 2 mi. N Sylva.","Jackson",35.39333,-83.19945,"NC","7/19/1962","","R.D. Suttkus, J.S. Ramsey & W.T. Mason"
"TU","29675","1","Cottidae","Cottus bairdii","Scott Creek, trib. to Tuckasegee River, 6.6 mi. NE Sylva, Hwy. 23.","Jackson",35.40611,-83.12473,"NC","8/9/1962","","J.S. Ramsey & H.H. Howell"
"TU","190415","33","Cottidae","Cottus bairdii","Tuckasegee River above Dillsboro","Jackson",35.35389,-83.24,"NC","4/25/1999","","Bart & Piller"
"TU","29546","1","Cottidae","Cottus bairdii","West Fork Tuckasegee River 3.3 mi. SW jct. with East Fork, Hwy. 107.","Jackson",35.23806,-83.135,"NC","7/18/1962","","J.S. Ramsey & H.H. Howell"
"TU","28008","18","Cottidae","Cottus bairdii","Cartoogechaye Creek 2.5 mi. S Franklin, Hwy. 441.","Macon",35.15805,-83.39167,"NC","6/3/1962","","J.S. Ramsey"
"TU","29531","18","Cottidae","Cottus bairdii","Cartoogechaye Creek, trib. Little Tennessee River, 2.5 mi. S Franklin, Hwy. 441.","Macon",35.15805,-83.39167,"NC","7/12/1962","","J.S. Ramsey, H.H. & D.H. Howell"
"TU","193772","12","Cottidae","Cottus bairdii","Cowee Creek at Cowee Creek Rd., West Mills","Macon",35.26229,-83.409,"NC","10/2/2001","","H.L. Bart & K.R. Piller"
"TU","29511","18","Cottidae","Cottus bairdii","Cullasaja River (below Cullasaja Falls) 5.0 mi. SE Franklin, Hwy. 64.","Macon",35.16111,-83.31389,"NC","7/12/1962","","J.S. Ramsey, H.H. & D.H. Howell"
"TU","194293","26","Cottidae","Cottus bairdii","Cullasaja River at camping area along US 64, ESE of Franklin (Peaceful Cove Rd. downstream to campground along US 64)","Macon",35.141,-83.298,"NC","4/6/2002","","Bart, Piller, Tipton, Blanton"
"TU","186794","6","Cottidae","Cottus bairdii","Ellijay Creek, trib. to Cullasaja River, about 6 mi. SE Franklin, E of Hwy. 64.","Macon",35.16611,-83.30722,"NC","7/12/1962","","J.S. Ramsey, H.H. & D.H. Howell"
"TU","193757","4","Cottidae","Cottus bairdii","Little Tennessee River at NC 28, 0.2 mi. S. Iotla","Macon",35.23502,-83.39462,"NC","10/2/2001","","H.L. Bart Jr."
"TU","29207","7","Cottidae","Cottus bairdii","Little Tennessee River, 5 mi. NW Franklin, Hwy. 28.","Macon",35.24778,-83.39667,"NC","7/19/1962","","R.D. Suttkus, J.S. Ramsey & W.T. Mason"
"TU","32809","1","Cottidae","Cottus bairdii","Nantahala River 12.2 mi. NE of Andrews (0.6 mi. E on hardtop rd.) Hwy. 19.","Macon",35.29861,-83.65528,"NC","6/3/1964","","R.D. Suttkus & J.S. Ramsey"
"TU","29709","17","Cottidae","Cottus bairdii","Nantahala River 12.3 mi. SW Franklin, Hwy. 64.","Macon",35.1175,-82.9275,"NC","8/12/1962","","J.S. Ramsey"
"TU","25396","1","Cottidae","Cottus bairdii","Ivy River, 3.5 mi. E of point on Hwy. 25E, 6.7 mi. N Weaverville.","Madison",35.79167,-82.54028,"NC","6/4/1961","","J.S. Ramsey & K.G. Conture"
"TU","26221","5","Cottidae","Cottus bairdii","Oconaluftee River at Ela, Hwy. 19.","Swain",35.44584,-83.38055,"NC","7/19/1962","","R.D. Suttkus, J.S. Ramsey & W.T. Mason"
"TU","194301","21","Cottidae","Cottus bairdii","Sawmill Creek at Little Tennessee River confluence","Swain",35.356,-83.507,"NC","4/7/2002","","Bart, Piller, Tipton"
"TU","188861","10","Cottidae","Cottus bairdii","Tuckasegee River at Ela, just below mouth of Copper Creek.","Swain",35.45222,-83.39361,"NC","4/25/1999","","H.L. Bart & K.R. Piller"
"TU","29423","66","Cottidae","Cottus bairdii","Bearwallow Creek, trib. to Toxaway River, below 60' falls, 1.7 mi. N of SC State line.","Translyvania",35.07861,-82.91139,"NC","6/29/1962","","W.S. Woolcott, J.S. Ramsey & H.H. Howell"
"TU","194279","49","Cottidae","Cottus bairdii","French Broad River at Lion Mnt. Rd., SE of Calvert","Translyvania",35.149,-82.8,"NC","4/6/2002","","Bart, Piller, Blanton, Tipton"
"TU","29412","3","Cottidae","Cottus bairdii","Toxaway River at mouth of Toxaway Creek 0.9 mi. due N of SC State line.","Translyvania",35.07028,-82.88695,"NC","6/27/1962","","W.S. Woolcott, J.S. Ramsey & H.H. Howell"
"TU","29289","20","Cottidae","Cottus bairdii","Bearwallow Creek at jct. with Toxaway River 2.0 mi. due N of SC State line, elevation 1420'.","Transylvania",35.08167,-82.90472,"NC","6/10/1962","","J.S. Ramsey & W.S. Woolcott"
"TU","29262","40","Cottidae","Cottus bairdii","Bearwallow Creek near confluence with Toxaway River, 1.9 mi. due N of NC-SC State line, elevation 1410'.","Transylvania",35.08167,-82.90472,"NC","6/7/1962","","J.S. Ramsey & W.S. Woolcott"
"TU","29797","53","Cottidae","Cottus bairdii","Bearwallow Creek near jct. with Toxaway River about 2 mi. N of SC state line.","Transylvania",35.08167,-82.90472,"NC","8/26/1962","","J.S. Ramsey"
"TU","29634","7","Cottidae","Cottus bairdii","Catheys Creek, trib. to French Broad River, 3.5 mi. SW Brevard, just N of Hwy. 64.","Transylvania",35.19889,-82.77861,"NC","8/1/1962","","J.S. Ramsey & H.H. Howell"
"TU","29648","2","Cottidae","Cottus bairdii","East Fork French Broad River, about 1.75 mi. due SE Rosman.","Transylvania",35.13306,-82.7925,"NC","8/1/1962","","J.S. Ramsey & H.H. Howell"
"TU","25949","8","Cottidae","Cottus bairdii","French Broad River 1 mi. W Rosman, Hwy. 64.","Transylvania",35.14305,-82.83778,"NC","6/20/1962","","R.D. Suttkus & M.M. May"
"TU","29615","24","Cottidae","Cottus bairdii","Laurel Creek, trib. to Little River, about 4.5 mi. S Penrose, gravel road.","Transylvania",35.2025,-82.64083,"NC","8/1/1962","","J.S. Ramsey & H.H. Howell"
"TU","29606","43","Cottidae","Cottus bairdii","Middle Fork French Broad River 1.9 mi. S Rosman, Hwy. 178.","Transylvania",35.11111,-82.81194,"NC","7/31/1962","","J.S. Ramsey & H.H. Howell"
"TU","29579","10","Cottidae","Cottus bairdii","Toxaway River & Bearwallow Creek 2.0 mi. N of SC state line.","Transylvania",35.07861,-82.91139,"NC","7/22/1962","","J.S. Ramsey & E. Vivian"
"TU","29285","2","Cottidae","Cottus bairdii","Toxaway River 2 mi. due N of SC State line, elevation 1420'.","Transylvania",35.08167,-82.90472,"NC","6/10/1962","","J.S. Ramsey & W.S. Woolcott"
"TU","29361","17","Cottidae","Cottus bairdii","West Fork French Broad River 2.0 mi. W Rosman, Hwy. 64.","Transylvania",35.13889,-82.85083,"NC","6/21/1962","","W.S. Woolcott, J.S. Ramsey & H.H. Howell"
"TU","29282","22","Cottidae","Cottus bairdii","West Fork of French Broad River about 1 mi. W Rosman, Hwy. 64.","Transylvania",35.14305,-82.83778,"NC","6/9/1962","","J.S. Ramsey & W.S. Woolcott"
"TU","29174","27","Cottidae","Cottus bairdii","West Fork of French Broad River about 2 mi. W Rosman, Hwy. 64.","Transylvania",35.14305,-82.83778,"NC","7/19/1962","","R.D. Suttkus, J.S. Ramsey & W.S. Woolcott"
"TU","199693","1","Cottidae","Cottus bairdii","Cane River along Jacks Creek Rd. ~ 4km W Bernsville","Yancey",35.91426,-82.3549,"NC","8/14/2004","","F. F. Cashner, R. E. Blanton, J. W. Johansen S. Woltmann"
"TVA","","17","Cottidae","Cottus bairdii","Elk River, SR 1305 Elk River Road","Avery",36.195593,-81.970234,"NC","39254","",""
"TVA","","1","Cottidae","Cottus bairdii","Elk River, SR 1305 Elk River Road","Avery",36.195593,-81.970234,"NC","41008","",""
"TVA","","19","Cottidae","Cottus bairdii","Elk River, SR 1305 Elk River Road","Avery",36.195593,-81.970234,"NC","35600","",""
"TVA","","4","Cottidae","Cottus bairdii","Elk River, SR 1305 Elk River Road","Avery",36.195593,-81.970234,"NC","37474","",""
"UAIC","9500.0499999999993","1","Cottidae","Cottus bairdii","Avery; North Toe River along Co. Rd. 1189 below a sand mine, 4.4 mi ENE of Spruce Pine (Nolichucky River)","Avery",35.9811111,-82.0163889,"NC","9/14/1984","","E.F. Menhinick, et al."
"UAIC","8911.0300000000007","2","Cottidae","Cottus bairdii","Buncombe; Cane Creek at Co. Rd. 3138, ca. 0.1 mi SE of Co. Rd. 3136, ca. 4 mi ESE of Skyland","Buncombe",35.4661111,-82.4572222,"NC","6/14/1979","","B.H. Bauer, J.L. Harris, R.T. Bryant"
"UAIC","9458.09","4","Cottidae","Cottus bairdii","Buncombe; Cane Creek below Co. Rd. 2784, below Echo Lake, 3.3 mi NE of Fairview","Buncombe",35.5433333,-82.3538889,"NC","9/19/1981","","E.F. Menhinick & Limnology Class"
"UAIC","902.03","4","Cottidae","Cottus bairdii","Buncombe; French Broad -Swannanoa River","Buncombe",35.6105556,-82.3636111,"NC","8/6/1972","","Y.D. Williams"
"UAIC","1413.06","4","Cottidae","Cottus bairdii","Buncombe; Swannanoa River at Swannanoa","Buncombe",35.6011111,-82.4011111,"NC","8/6/1972","","J.D. Williams"
"UAIC","9460.06","3","Cottidae","Cottus bairdii","Buncombe; Swannanoa River Below co. rd. 2416, 1.2 mi NW of Wilson","Buncombe",35.6072222,-82.44,"NC","9/20/1981","","E.F. Menhinick and Limnology class"
"UAIC","9481.0400000000009","5","Cottidae","Cottus bairdii","Cherokee; trib. to Toccoa River at Co. Rd. 1101, 4.4 mi WSW of Hothouse","Cherokee",34.9963889,-84.3044444,"NC","5/12/1982","","E.F. Menhinick & Aquatic Biology Class"
"UAIC","9476.06","19","Cottidae","Cottus bairdii","Cherokee; Valley River ar co. rd. 1624, above US Hwy 19-23, 2.7 mi NW","Cherokee",35.1030556,-84.0105556,"NC","8/12/1981","","B. Bonner, R.J. Brown, C.L. Wilson, et al"
"UAIC","12544.07","21","Cottidae","Cottus bairdii","Cherokee; Valley River at Levis Road, 2.7 mi NE of Murphy","Cherokee",35.1033333,-84.0108333,"NC","7/1/2000","","D.A. Neely"
"UAIC","13120.02","1","Cottidae","Cottus bairdii","Cherokee; Valley River at Robbinsville Road in Andrews","Cherokee",35.2052778,-83.8186111,"NC","12/2/2000","","D.A. Neely"
"UAIC","10524.11","20","Cottidae","Cottus bairdii","Clay; Brasstown Creek on Co. Rd. ca. 2 mi SE of Brasstown by a dairy products building","Clay",35.0166667,-83.9341667,"NC","9/28/1992","","B.R. Kuhajda, R.L. Mayden, R.M. Wood"
"UAIC","1691.02","5","Cottidae","Cottus bairdii","Clay; Shooting Creek tributary, ca. 20 mi E of Murphy","Clay",35.0811111,-83.9855556,"NC","7/19/1965","","W.M. Howell"
"UAIC","10387.06","32","Cottidae","Cottus bairdii","Graham; Junction of Snowbird Creek & Little Snowbird Creek, 5 mi SW of Robbinsville","Graham",35.2702778,-83.8705556,"NC","10/4/1991","","B.R. Kuhajda, R.L. Mayden, R.M. Wood"
"UAIC","10246.1","4","Cottidae","Cottus bairdii","Haywood; Pigeon River at Co. Rd. 1876, just off NC Hwy 110, 0.5 mi ENE of Woodrow","Haywood",35.4791667,-82.8819444,"NC","10/5/1991","","B.R. Kuhajda, R.L. Mayden, R.M. Wood"
"UAIC","13135.02","5","Cottidae","Cottus bairdii","Haywood; West Fork Pigeon River at jct of US Hwy 276 & NC Hwy 215 in Bethel","Haywood",35.4705556,-82.8847222,"NC","12/1/2000","","D.A. Neely"
"UAIC","9532.08","10","Cottidae","Cottus bairdii","Henderson; Mills River above National Forest Road above Co. Rd. 1345, 4.7 mi WNW of Mills River community.","Henderson",35.3927778,-82.61,"NC","9/26/1987","","E.F. Menhinick, Limno cl."
"UAIC","9533.07","7","Cottidae","Cottus bairdii","Henderson; Mills River at end of Co. Rd. 1337 along corn field, 1.6 mi WNW of MIlls River Community","Henderson",35.3986111,-82.5930556,"NC","9/26/1987","","E.F. Menhinick, Limnology Class"
"UAIC","8913.0400000000009","6","Cottidae","Cottus bairdii","Henderson; Mills River at NC Hwy 280-191 at Mills River (town)","Henderson",35.3916667,-82.5680556,"NC","6/14/1979","","B.H. Bauer, R.T. Bryant, J.L. Harris"
"UAIC","5993.1","40","Cottidae","Cottus bairdii","Jackson; CANEY FK CR AT NC 107 AND CO RD 1737","Jackson",35.2972222,-83.1458333,"NC","7/1/1980","","C. Douglas, P. Crittendon, R. Eager, D. Lee, R. Brice, G. Dinkins, K. DeLozier, D. Clark, D. Underwood, B. Swiney"
"UAIC","8975.02","22","Cottidae","Cottus bairdii","Jackson; Tuckasegee River at river mi 36","Jackson",35.3372222,-83.2,"NC","7/1/1980","","P. Crittenden & USFWS"
"UAIC","8974.0300000000007","25","Cottidae","Cottus bairdii","Jackson; Tuckasegee River at RM 35.25","Jackson",35.3405556,-83.2266667,"NC","7/1/1980","","G. Dinkins, C. Douglas, D. Lee, B. Swiney"
"UAIC","9484.1","18","Cottidae","Cottus bairdii","Macon; Buck Creek below NC Hwy 28, 5.3 mi NW of Highlands","Macon",35.1233333,-83.2669444,"NC","5/14/1982","","E.F. Menhinick & Aquatic Biology Class"
"UAIC","9483.09","1","Cottidae","Cottus bairdii","Macon; Burnington Creek at Co. Rd. 1370, 0.3 mi NW of Stiles","Macon",35.0711111,-83.2252778,"NC","5/13/1982","","E.F. Menhinick,Aq Biol cl"
"UAIC","6328.06","9","Cottidae","Cottus bairdii","Macon; Burnington Creek at NC Hwy 1370, ca. 0.2 mi from jct. NC Hwy 1364","Macon",35.2775,-83.4805556,"NC","9/3/1980","","Douglas, Dinkins, Underwood, DeLozier"
"UAIC","5808.1","9","Cottidae","Cottus bairdii","Macon; BURNINGTOWN CR CONFL LITTLE TENNESSEE","Macon",35.2880556,-83.4844444,"NC","10/13/1979","","J. S. Williams"
"UAIC","9520.08","2","Cottidae","Cottus bairdii","Macon; Cullasaja River along NC Hwy 28, 5.0 mi SE of Franklin","Macon",35.1436111,-83.3094444,"NC","11/2/1986","","E.F. Menhinick, et al."
"UAIC","9445.08","6","Cottidae","Cottus bairdii","Macon; Cullasaja River along US Hwy 64, 0.2 mi NW of co. Rd. 1533,0.3 mi NW of Gneiss","Macon",35.1372222,-83.285,"NC","5/13/1981","","E.F. Menhinick, and Aqua. Biology Class"
"UAIC","8938.0400000000009","7","Cottidae","Cottus bairdii","Macon; Cullasaja River at co. rd. 1677 off Hwy 64","Macon",35.1416667,-83.2944444,"NC","4/4/1980","","Brice, Brown, Clark, C. Douglas, Dinkins"
"UAIC","9089.01","14","Cottidae","Cottus bairdii","Macon; Cullasaja River at Hwy 64 & 441, (sta. E-50) (Little Tennessee River)","Macon",35.17,-83.3652778,"NC","6/11/1980","","USFWS"
"UAIC","11877.04","17","Cottidae","Cottus bairdii","Macon; Cullasaja River at jct US Hwy 64 & Peaceful Cove Road","Macon",35.1416667,-83.2941667,"NC","4/19/1997","","B.R. Kuhajda, D.A. Neely"
"UAIC","8948.0400000000009","25","Cottidae","Cottus bairdii","Macon; Cullasaja River at River mile 6","Macon",35.155,-83.3172222,"NC","5/1/1980","","D. Lee and USFWS"
"UAIC","9485.0499999999993","12","Cottidae","Cottus bairdii","Macon; Cullasaja River below co.rd. 1677, 0.9 mi NW of Gneiss","Macon",35.1419444,-83.2925,"NC","5/14/1982","","E.F. Menhinick & Aquatic Biology Class"
"UAIC","5976.09","1","Cottidae","Cottus bairdii","Macon; Cullasaja River off Hwy 64 between Walnut & Buck creeks, near Griese, 6.5 mi SE of Franklin","Macon",35.1252778,-83.285,"NC","5/21/1980","","J.S. Williams"
"UAIC","5996.08","7","Cottidae","Cottus bairdii","Macon; LITTLE TENNESSEE R AT RIVER MI 100.5","Macon",35.2763889,-83.4691667,"NC","7/2/1980","","C. Douglas, P. Crittendon, R. Eager, D. Lee, R. Brice, G. Dinkins, K. DeLozier, D. Clark, D. Underwood, B. Swiney"
"UAIC","12932.1","9","Cottidae","Cottus bairdii","Macon; Little Tennessee River at NC Hwy 28 in Iotla","Macon",35.235,-83.3961111,"NC","7/2/2000","","D.A. Neely, S.L. Powers"
"UAIC","12474.1","13","Cottidae","Cottus bairdii","Macon; Little Tennessee River at unnamed C. Rd. at GA state line, 1.8 mi N of Dillard","Macon",34.9933333,-83.3813889,"NC","4/1/2000","","D.A. Neely"
"UAIC","11643.1","1","Cottidae","Cottus bairdii","Macon; Little Tennessee River just upstream of NC Hwy 28 at Iotla","Macon",35.2358333,-83.3961111,"NC","4/19/1997","","B.R. Kuhajda, D.A. Neely"
"UAIC","6329.07","3","Cottidae","Cottus bairdii","Macon; Little Tennessee River, Mile 100.5, 100 yards upstream from Lost Bridge.","Macon",35.2766667,-83.4519444,"NC","9/3/1980","","Dinkins, Douglas, DeLozier, Clark, and"
"UAIC","9092.01","14","Cottidae","Cottus bairdii","Macon; Nantahala River, 100 M upstream from bridge and power station","Macon",35.2844444,-83.6697222,"NC","8/7/1980","","USFWS"
"UAIC","9482.1200000000008","10","Cottidae","Cottus bairdii","Macon; Wayah Creek at Co. Rd. 1309, 1.5 mi NNW of Cartoogechaye","Macon",35.1375,-83.4891667,"NC","5/13/1982","","E.F. Menhinick, Aquatic Biology Class"
"UAIC","13137.01","16","Cottidae","Cottus bairdii","Macon; Whiteoak Creek at jct with Nantahala River, along Wayah Road, 2.2 mi NNW of Kyle","Macon",35.2505556,-83.6408333,"NC","12/2/2000","","D.A. Neely"
"UAIC","9455.1","10","Cottidae","Cottus bairdii","Mitchell; North Toe River along Co. Rd. 1121, 2.0 mi WNW of Spruce Pine (Nolichucky River)","Mitchell",35.9277778,-82.0963889,"NC","9/6/1981","","E.F. Menhinick & Limnology Class"
"UAIC","9501.06","4","Cottidae","Cottus bairdii","Mitchell; North Toe River at end of Co. Rd. 1268 at foot bridge, 3.7 mi E of Spruce Pine (Nolichucky River)","Mitchell",35.9175,-81.9980556,"NC","9/14/1984","","E.F. Menhinick, Perez, Weisman"
"UAIC","12700.14","1","Cottidae","Cottus bairdii","Polk; Green River at Green River Cove Rd., 3.4 mi NE of Saluda","Polk",35.2644444,-82.32,"NC","7/16/2000","","D.A. Neely, S.L. Powers, G.L. Lawrence"
"UAIC","5809.1","5","Cottidae","Cottus bairdii","Swain; Brush Creek at c onfluence with Little Tennessee River, 12 mi NW of Franklin","Swain",35.3197222,-83.5177778,"NC","10/13/1979","","J. S. Williams"
"UAIC","8983.02","33","Cottidae","Cottus bairdii","Swain; Eagle Creek at confluence with Fontana Lake & upstream ca. 0.5 mi","Swain",35.4586111,-83.7866667,"NC","8/5/1980","","USFWS"
"UAIC","9091.01","11","Cottidae","Cottus bairdii","Swain; Forney Creek at confluence w/Fontana Lake (Little Tennessee River) and upstream","Swain",35.4425,-83.5641667,"NC","8/6/1980","","USFWS"
"UAIC","9088.01","3","Cottidae","Cottus bairdii","Swain; Hazel Creek, trib. to Little tennessee River, 2,000 ft. below jct. with Rowan Branch","Swain",35.4747222,-83.7252778,"NC","5/7/1980","","D. Lee, USFWS"
"UAIC","5984.1","5","Cottidae","Cottus bairdii","Swain; LITTLE TENNESSEE R AT RIVER MILE 89.9","Swain",35.3552778,-83.5052778,"NC","6/5/1980","","C. Dinkins, B. Swiney, D. Lee, C. Douglas, J. Harsson"
"UAIC","5991.06","4","Cottidae","Cottus bairdii","Swain; LITTLE TENNESSEE R AT RIVER MILE 98.2","Swain",35.2973,-83.4962,"NC","7/2/1980","","C. Douglas, P. Crittendon, R. Eager, D. Lee, R. Brice, G. Dinkins, K. DeLozier, D. Clark, D. Underwood, B. Swiney"
"UAIC","1657.02","1","Cottidae","Cottus bairdii","Swain; Oconaluftee River off Highway 441 at entrance to Great Smoky Mountain Park ca. 3-4 mi N of Cherokee, NC","Swain",35.4688889,-83.3230556,"NC","7/21/1965","","W.M. Howell"
